Word,Part of Speech,Meaning,Example (Wolaytta),Example (English)
gawwiina,adjective,moving crowd (refers to insects close one another)%,gawwiina paalliya do'ata,"humming insects
gaytotettaa gaytotaa%1. noun%"
gawwiina,adjective,relationship; connection; interaction;,,
gayyiya,noun,"ladder, a portable piece of equipment with rungs attached to 
sides made of metal, wood, or rope used to climb up or down%","Burttukaanee 
diyosaa gakkanawu gayyiya go'etta.","Use the ladder to reach the orange on the 
tree."
gazzaa,noun,"mottle, a patch of color%",Miizzee bollan gazzay dees.,"There 
is a patch of color on the cow's body.
gececca (geceeccula)%1. adjective%"
gazzaa,noun,"ugly, not attractive, not appealing, not 
good looking%(syn) [iita, lo''enna, geeruuca, kinkkima, meri baynna.]%",,
gazzaa,noun,aged,,
gedaa,noun,"hind leg, hind limb, a limb situated near or toward the tail of 
an animal%",,
gedaa,noun,meat (from hind leg)%(syn) [paashshaa.],,
otettaa,noun,virginity%,A ba geela'otettaa xayaasu.,"She lost her 
virginity."
gelabeennaaro,noun,maiden; bachelorette; spinster%,"Gelabeennaaro giyora 
azinaa gelabeenna yelaga na'iyo.",A bachelorette is a young unmarried woman.
gelidaaro,noun,"matron, a married woman%","A azinaa gelidaaro gidikkokka, 
hanno gakkanaashin na'a yelabeykku.","Although she is a married woman, she has 
not given birth yet."
geliyabaa,noun,ingredient%,Qimaamee daro qommo quman geliyabaa.,"Spice is
an ingredient in many food dishes."
gene,adjective,harmful; adversarial; opposing%,gene qofaa,"harmful 
thought"
gereessaa,noun,song of victory%,"I gereessan bantta so asaa minotaa 
yootiis.",He told of the brave quality of his family in the song of victory.
gerggeedaa,noun,"rheumatism, a painful condition of the joints or muscles%",gerggeedaa sahuwa,the illness of rheumatism
gerzzumida,adjective,calloused%,gerzzumida kushiya,the calloused hand
gezziya,noun,"highland, hill country, cold area, high elevation%","Banggay 
gezziyan mokkees.",Barley is grown in the highlands.
gidduwan,preposition,between%,Haa yaada nu giidon utta.,"Come and sit 
between us."
abbáá,noun,sea%,Giddo abbán maxinee de'ees.,The sea is salty.
gidenna,adjective,inadequate; unsatisfactory; insufficient%,"Gidenna 
giyogee issibay koshshiyogaappe guuxxiyogaa.","Unsatisfactory means something is
not enough or insufficient."
gidin,adverb,"either or, neither nor%","A gidin A keettaayyiyo gidinkka 
zal''iyappe woriya demmibookkona.","Neither he nor his wife had profited from 
business."
gidiya,adjective,enough%,Ta gidiya miishshaa immaasi.,"I gave her enough 
money."
gidiya,adjective,enough%,Ta gidiya miishshaa immaasi.,"I gave her enough 
money.
gidoppe attin%1. adverb%"
gidiya,adjective,"nevertheless, by the way%","Wogaa laammanawu de'iya 
qaaday guutta. Gidoppe attin, nuuni ane mali be'oos.","There is little chance 
that we will succeed in changing the law. Nevertheless, it is important that we 
try."
gifaataa,noun,hunt (of a king)%,"Gifaataa giyogee kase wode oli baynnan 
tammu laytta gakkikko, attuma asi moonnichcha kiyenna mala kawoy kessiyo 
shankkaa.","'Gifata' means in the olden days, when people lived without war for 
ten successive years, the king led the men on a hunting excursion so that they 
may not be considered cowards."
poliya,noun,serious%,giidobaa poliyagaa,a serious person
giigenna,adjective,mismatched; unfit; unsuitable; improper%,"I giigenna 
kalssiya wottiis.",He wore mismatched socks.
giigiya,adjective,fit; elegant%,keehi giigiya maayuwa,"the elegant 
clothes"
giirettaa,noun,sound%(syn) [cenggurssaa]%,,
giirettaa,noun,"producing sound, bang, alarm",,
giirettaa,noun,taxation%,Giirayyoo cora wogay dees.,"There are many laws 
regarding taxation."
gilaviya,noun,"globe, a shaped covering for the hand%","Aakimee gilaviya 
kushiyan aattidi masunttaa qachchiis.","Wearing the glove, the doctor dressed 
the wound."
gimbbiya,noun,tower; building%(syn) [hintstsaa]%,,
gimbbiya,noun,stone fence,,
ginddettaa,noun,"bread (combination of doughs of different flours with enset
product)%",I ginddettaa maattaara miis.,He ate bread with milk.
ginddettaa,noun,spurring (giddy-up)%,"Ginddettay paraa keehi woxxanaadan 
oottiis.",Spurring the horse made it run fast.
giraaca,adjective,gray (mule color)%,giraaca baquliyo,"a gray-colored 
mule"
giraasso,adjective,greasy %,Giraasso kushiya meecettaychchada kattaa ma.,Eat the food after washing your greasy hands.
giraasuwa,noun,grease %,A kushee zayttenne giraaso kanchche,"His hands 
are covered with oil and grease."
gishsha,adverb,instead%,"Ta tamaaresoo biikke; tamaaresoo baana gishshaa 
giya baana.","I shall not go to school; I shall goto the market instead.
gishshaa eqqiis%1. transitive verb%"
gishsha,adverb,represent%,"Ne gishshaa ta eqqana; ne soo 
ba.",I will represent you; go home.
gisttiya,noun,wheat%,Gisttiyappe daabboy uukettees.,"Bread is made from 
wheat.
gita asa%1. noun%"
gisttiya,noun,nobleman (outdated Amharic title)%,Gita asi bonchchettees.,A nobleman is respected.
gitiya,noun,"trap, net, snare, a device designed to catch an animal and kill
it or prevent it from escaping%",Kafuwa gitiyan oyqqiis.,"He caught the bird 
with a trap.
gitiyan oyqqiis%1. transitive verb%"
gitiya,noun,trap%,A do'aa gitiyan oyqqaasu.,"She 
trapped the beast with a trap."
gittuwa,noun,"agent, representative, somebody representing another%(syn) 
[gishshawu eqqidaagaa]%",,
gittuwa,noun,"representation
gixxi denddiis%1. intransitive verb%",,
gittuwa,noun,get ready%,"Nu biittiya hiyyeesatettaara 
olettanawu gixxa denddaasu.",Our country is ready to fight against poverty.
glaaviya,noun,"glove, a shaped covering for the hand %","Dottoreti aakimiiddi
glaaviya kushiyan aattoosona.","Doctors put gloves on their hands when treating 
patients.
godare awaa%1. noun%"
glaaviya,noun,twilight%,"Godare awaa giyogee away wullana hanishin 
kiyiya lefa awaa.","Twilight is the faint sunlight which appears as the sun 
sets.
godare uuttaa%1. noun%"
glaaviya,noun,aloe%,Godare uuttaadan cammees.,"It is as bitter as 
aloe."
godare,adjective,"greedy, big eater%(syn) [habadiina, yora, yiiqetiya, 
gawulla, gawuda, gaphigapha, gadulla, qaatta, yaare, hallamma qarccamma, 
qaaxxiya]%",,
godare,adjective,"cruel; ruthless; brutal; inhuman
godi baynna%1. adjective%",,
godare,adjective,ownerless%,godi baynna hariya,ownerless donkey
godolo,adjective,no-account; invalid; ruined; futile; pointless; trivial;,,
golaa,noun,sisal; fluff%,Wodoruwa golaappe dooqqeettees.,"We twist a rope
with fluff."
gomppaa,noun,center%,,
gomppaa,noun,content; width%,,
gomppaa,noun,area,,
gondduwa,noun,"army worm, pest, hairy caterpillar%","Gonddoy carshshaanne 
kattaa worees.",Army worms kill seedlings and crops.
gonggiya,noun,"lumber, timber, boards, planks, a flat piece of wood, 
plastic, or other rigid material, used for a particular purpose%","Aayyiya 
gonggiya bolli unccaa qanxxawus.",Mother chops enset product on the board.
goobatettaa,noun,bravery; cleverness; wisdom; adroitness%,"Hisaabe 
asttamaaree oyshaa sohuwara ootti aggiis. A goobatettay tana malaalees.","The 
mathematics teacher solved the problem with ease. His cleverness astonished me."
googettaa,noun,peeling%,Masunttay googettaa doommiis.,"The wound started 
peeling."
goommariya,noun,"toad, amphibian similar to a frog and bigger in size%",Goommaree shodhdhiyappe gitatees.,A toad is bigger than a frog.
gooranchchuwa,noun,"stable, a building in which large types of livestock, 
are kept%",Booraassi gooranchchuwa giigissiis.,He built a stable for the ox.
goottaa,noun,plaiting needle%,Masoofee goottan sikettees.,"The 'mesob' 
basket was sewn with the plaiting needle."
gorbbiya,noun,rumen; rectum%,"Wolqqaama namisaappe denddidaagan assi 
gorbbee aadhdhi wodhdhiis.",His rumen collapsed because of serious hunger.
gordda,adjective,closed; blocked%,Gordda penggee karqqi giis dooyettenna.,The closed door was stuck and would not open.
gotiya,noun,windstorm; whirlwind%,"Gotee aadhdhiichchiis. Ha""i sa'ay woppa.",The windstorm has passed. It is all quiet now.
gubbana,adjective,cloudy%,gubbana gallassa,"cloudy day
gudunttaa ashuwa%1. noun%"
gubbana,adjective,pork%,Hanno gakkanaassi gudunttaa ashuwa ma eray?,Have you ever eaten pork?
gudunttaa,noun,pig%,Gudunttay waassees.,A pig grunts.
a,adjective,popular; famous; prominent%,"I biittaw gul''a asa; asa 
ubbay A bonchchees.","He is a popular man; everybody in the vicinity respects 
him."
malatiyabata,noun,insect%,"Gumbburo malatiyabatussi usuppun tohoy 
de'ees.",An insect has six legs.
gumiya,noun,"restitution, compensation paid for loss of life%","Beni wode, 
shemppuwa worida uray shemppoy hayqqido keetta asaassi gumiya qanxxees.","In 
olden days, a murderer paid restitution to the victim's family."
gunddaa,noun,cripple%,Gundday hemettanawu danddayenna.,"A cripple is 
unable to walk properly."
gunddatettaa,noun,"paralysis, loss of voluntary movement as a result of 
damage to nerve or muscle function %","naa""u tohuwa gunddettaa","paralysis of 
both legs"
guntturiyo,noun,fat calf%,,
guntturiyo,noun,"heifer%(syn) [ussiyo]
guphphu giis%1. intransitive verb%",,
guntturiyo,noun,"lie face downward, fall down on one's face%",I xoossaa woossanawu sa'an guphphu giis.,"He laid his face down on the ground 
for prayer.
guppi geliis%1. transitive verb%"
guntturiyo,noun,plunge; dive%,"I na'aa ashshanawu haattan 
guppi geliis.",He plunged into the river in order to save the child.
gurbbaa,noun,"stem, stem of false banana%","Bone maatay qaaxuwattiyode 
miizzay gurbbaa mees.","Cows eat the stem of false bananas when there is 
shortage of grass in the dry season."
gusaa,noun,"semen, sperm, fluid ejaculated by male%(syn) [maqataa]%",,
gusaa,noun,"fluid, 
fluid ejaculated by female",,
guttuwa,noun,owl%,Guttoy waassees.,An owl hoots.
guufiya,noun,"cane, staff, walking stick%","Cima asay guufiya oyqqi 
hemettees.","Old people walk holding a walking stick.
guuhaa (guu'aa) %1. noun%"
guufiya,noun,"goiter, enlargement of the thyroid gland%","Guuhaa 
giyogee ayoodiniya pacaappe denddidaagan qooriyan kixxiyagaa.","A goiter is a 
swelling of the throat caused by a deficiency of iodine."
guurumettaa,noun,rumble; growl %,"Godariya guurumettay qeeri naata 
daganttiis.",The hyena's rumble startled the small children.
guurunttaa,noun,snarl; growl%,godariya guurunttaa,the growl of a hyena
guuttaa,adverb,a little%,Eti eriyobay guutta.,They know a little.
guxunaatta,adjective,"ignoble; shameful; disgraceful; rude; insolent; 
disrespectful %",Wuussi guxunaatta eeshsha.,Theft is a disgraceful behavior.
guxuniya,noun,worm; maggot %,Kuttoy darotoo guxuniya mees.,"Hens often 
feed on worms."
gùùtuwa,noun,belittlement; ignominiousness; shame; disgrace; disrespect;,,
gúúliya,noun,prolonged rain%,Gúúliyaara meegoy kare kessenna.,"Since 
there is prolonged rain, it is too difficult to go out.
ha""i%1. adverb%"
gúúliya,noun,now%,Eti xeesoosappe ha''i heezzu saamintta.,"Now it has been
three weeks since they called.
ha""ippe doommin%1. adverb%"
gúúliya,noun,from now on%,"Ha''ippe doomin, I gaayiya uyenna.","From now on, he won't smoke cigarettes.
ha""isawu%1. adverb%"
gúúliya,noun,temporarily; for now; for the time being%,"Nu ha keettiyo 
ha""issawu keraa ekkida.","We rented this house temporarily.
ha''aa%1. interjection%"
gúúliya,noun,ouch %,Ha''aa! ta tirawu.,"Ouch! my chest hurts.
ha''ippe doommin%1. adverb%"
gúúliya,noun,from now on%,"Ha''ippe doommin, sijaaraa uyenna.","From now on, he won't smoke cigarettes.
ha''issawu%1. adjective%"
gúúliya,noun,"tentative, temporary%",ha''issawu oottiyo prograamiya,tentative program
haa,adverb,"here, this place%",Haa ya.,Come here.
haahotettaa,noun,distance%,"Wolaytta Sooddoppe Addisaabi gakkanassi 
haahotettay 329 kilomeetire.","The distance from Wolaita Soddo to Addis Ababa is
329 kilometers."
haani,adverb,here%,Ta haani days A yan dawusu.,"I live here and she lives
there."
haariyogaa,noun,"breed, raise (cattle)%",,
haariyogaa,noun,"enslavement%(syn) [aylleyiyogaa]
haasayaa wogaa%1. noun%",,
haariyogaa,noun,grammar%,Inggilizettuwa Hasayaa wogaa,"English 
grammar"
ollaa,noun,well%,Taani haattaa ollaappe kessanawu danddayikke.,"I 
am not able to draw the water from the well.
haattaa wadhdhiis%1. intransitive verb%"
ollaa,noun,swim %,"Naati hefintti pinnanawu 
haattaa wadhdhidosona.","The boys swam across the river.
haattaa waraa%1. noun%"
ollaa,noun,swimming%,Haattaa waray taani dosiyo ispportte.,Swimming is my favorite exercise.
haaya,interjection,come here%,Haaya! Ta nena haasayissanawu koyaas.,"Come
here! I wanted to talk to you."
habbeeruwa,noun,high fever%,Tana habbeerees.,I have a high fever.
hachchigalla,noun,next week (on the same day as today)%,hachchi galla,
haasaya,noun,gossip%,Kataman de'iya hada haasayay A sunttaa mooriis.,The gossip in the town ruined his reputation.
hagaa,pronoun,this (accusative masculine singular)%2 . adjective%,,
hagaa,pronoun,"this 
(accusative masculine singular)",,
hagalo,interjection,"reciprocating good wish, a response to an expression of
good wish to someone%",Hagalo ubbawukka!,Good luck to all of us!
hagan,adverb,here%,Hagan dees.,Here it is.
hagawu,adverb,here; this place%,"I naa""u gallassappe kase hagawu yiis.","He
came here two days ago."
hageeta,pronoun,these (accusative plural )%2 . adjective%,,
hageeta,pronoun,"these 
(accusative plural )",,
haggaaziyagaa,noun,server; volunteer; servant; laborer%,,
haggaaziyagaa,noun,"taxpayer%(syn) 
[giiriyagaa]",,
hajibala,adjective,splendid; wise; charming; attractive; smart; pretty;,,
halaa,noun,stretcher%,Haahosaa efiyo hargganchchati halan tookettoosona.,Patients carried to a distant place are carried on a stretcher.
halaqaa,noun,monitor; master; boss; supervisor%(syn) [abaaliya]%,,
halaqaa,noun,"chief; 
head; leader (of a village)",,
qarccamma,adjective,swallowing forcibly%,,
qarccamma,adjective,"greedy; gluttonous; 
voracious; stingy; miserly%(syn) [habadiina, yora, yiiqetiya, gawulla, gawuda, 
gaphigapha, gadulla, qaatta, yaare, godare, qaaxxiya]
halluuti giis%1. transitive verb%",,
qarccamma,adjective,refuse%,"Nuuni miishshaa tal''a giidi 
woossinkka halluuti giidi ixxiis.","We begged him to lend us money but he 
refused."
halqquma,adjective,"ill-cooked, not fully cooked, partially cooked%","Taani 
halqquma shukkaariya maanawu danddayikke.","I cannot eat this partially-cooked 
sweet potato."
haluwa,noun,"bottle gourd or calabash used for drinking coffee (small in 
size and having two openings both at the top and just below its neck)%","Daguwa 
asay tukkiya haluwan uyees.","Communal labor workers drink coffee from a small 
calabash."
halúwa,noun,skull%,"Woosanchchaa kaamee phonqqin, haloy keehi deshettiis.","Having been run over by a car, the beggar's skull was injured."
hamakkaa,noun,"tree, a kind of tree used to make a roof of a house%",Hamakkay zanddiidaa daddanaassi maaddees.,"'Hamaka' is a small, slender plant 
used to make the roof of huts."
guussaa,noun,welcome%,"A imattatussi lo''o hammu guussaa 
shiishshaasu.",She gave a warm welcome to the guests.
hamuusa,noun,"Thursday, the fourth day of the working week %","Oruwa kaallidi
Hamuusi wonttees.",Thursday comes after Wednesday.
hanana,adjective,possible; probable%,"Woxiya katoy ha guutta na'eessi 
hanenna.",It is not possible for this small girl to cook the wot.
hanccaqaro,adjective,"strong, very likely to succeed, win, or come to be",,
hankkuwa,pronoun,other; another%,"Ooratta maxaafay xayikko, taassi hankkuwa
imma.","If the new book is lost, give me another."
hanniira,adverb,this way (the place as female)%,"Hanniira yooppa; nena 
kanay saxxananne.",Don't come this way; the dog might bite you.
hanno,pronoun,this (accusative feminine singular)%2 . adjective%,,
hanno,pronoun,"this 
(accusative feminine singular)",,
hanttukettiya,adjective,"energetic; active; bouncing; animated; spirited; 
robust; enthusiastic; lively; vigorous; brisk; bouncy%",hanttukettiya,
haphaa,noun,cuddle %,Kuttiya phuuphulliya haphaa bolli dawusu.,"The hen 
is on the cuddle of eggs."
happurssiis,noun,"cook gently, cook softly, cook lightly, boil gently (to 
remove dirt)%","A qoociqoocuwa kattanaappe kasetada, ashuwa happurssaasu.","Before she cooked the 'qociqoco', she boiled the meat gently."
hara,adjective,other; another%,hara maayuwa,"other clothes
haraa heemmiis%1. transitive verb%"
hara,adjective,"rent, rent a cow to share profit%","I ta 
miizziyo haraa heemmidi 100 biraa woriya miis.","He got 100 birr profit renting 
my cow."
haraa,noun,rent (of cows for profit)%,I miizziyo haraa buuccees.,"He 
rented a cow in order to fatten it."
haraa,pronoun,"other, another, different kind%","I azinay hayqqin haraa 
gelaasu.",She married another man after her husband died.
haraqiya,noun,arm%,Qeeri naata haraqiya oyqqada tookkoppa.,"Don't lift 
children by their arms."
haraqiya,noun,liquor; alcohol%,Haraqee alkkoole ushsha.,"Liquor is an 
alcoholic drink."
harbbaynnuwa,noun,hare; rabbit%,Harbbaynniya keehi woxxawusu.,"A rabbit 
runs fast.
hargge malaataa%1. noun%"
harbbaynnuwa,noun,symptom%,Mishoy hargge malaata.,"Fever is symptom of
sickness."
hariyo,noun,"jenny, a female donkey%",Ha hariya maraa yelaasu.,"This jenny 
has had an offspring."
haroode,adverb,another time%,Nuuni haroode gayttana.,"We will meet 
another time."
hashiya,noun,"communal labor, communal work done by partners or small group 
turn by turn for the benefit of one another%",Hashiya oosoy oosuwa eesoyees.,Communal labor quickens work.
hashiya,noun,shoulder%,Bitanee konttaale gaashiya hashiyan tookkiis.,"The
man carried a quintal of teff on his shoulder.
hashiyan goyiis%1. intransitive verb%"
hashiya,noun,"loaf, spend time lazily%","Na'a diyagee 
hashiyan goyidi oosuwa wurssennan ixxiis.","The boy loafed and would not finish 
the work."
hasttama,numeral,thirty%,"I taappe aadhdhida saaminttan hasttamu biraa 
tal""iis.",He borrowed thirty birr from me last week.
haydaa,noun,history%,Wolaytta Haydaa,History of Wolaita
hayqqenna,adjective,immortal%,Hayqqenna asi de'ii?,"Is there anyone who 
is immortal?"
hayqqibeenna,adjective,alive; living%,hayqqibeenna asa,"a man who is 
alive"
hayqqida,adjective,dead%,Hayqqida medoossay xinqqees.,"Dead animals smell
bad."
hayqqiya,adjective,mortal%,Asi hayqqiyabaa.,Man is mortal.
hayquwa,noun,death%,Nagaraa waagay/damoozay/gatee hayquwa.,"The wage of 
sin is death."
haysiya,noun,story; fable; tale%,Haysiya yoota.,"Tell the story.
hayttaa kessiis%1. intransitive verb%"
haysiya,noun,make reputable%,"A oosoy nu keettaa 
asaassi hayttaa kessiis.",His actions made our family reputable.
he,adjective,that%,he maxaafaa,that book
hee,interjection,yes%(syn) [yee]%,,
hee,interjection,"really (surprise) reference to something
good happening
heede %1. adverb%",,
hee,interjection,"at that time, at that moment%",Taani nenaara heede gayttaas.,"I met you at that time.
heeraa asaa%1. noun%"
hee,interjection,"villagers, community, people who live in a village%",Heeraa asay di'oy yiyo wode issoy issuwara maadettiis.,"The villagers helped 
one another during the floods."
bollankka,adverb,"moreover, furthermore, in addition%","I eranchcha 
beero gadaawa, hegaa bollankka, lo''o shufeere.","He is a brilliant officer, 
moreover, he is a good driver."
hegeeti,pronoun,those (nominative plural)%2 . adjective%,,
hegeeti,pronoun,"those (nominative
plural)",,
hegeetihoo,interjection,there they are!%,"Eti hegeetihoo! Hagawu gakkana 
matidosona.","There they are! They are going to arrive here.
hekkul''iis%1. intransitive verb%"
hegeetihoo,interjection,"hop, skip, move along by hopping on one leg%","Tohoy deshettido na'ay hekkul""ees.",The child whose leg is hurt is hopping.
heregaa,noun,mirror%,"Ne som""uwa heregan xeella.","Take a look at your face
with the mirror.
hidootaa wottiis%1. transitive verb%"
heregaa,noun,hope%,"Taani ne ha laytti anjjettiyogaadan
hidootaa wottaas.","I hope you will graduate this year.
hiilla eraa%1. noun%"
heregaa,noun,"art, creation of beautiful things, the creation of 
beautiful or thought-provoking works%","Hiillaa eraa giddon misliya medhdhiyogee,
yettaynne, xaafuwa oosoy dees.","In art, there is painting, music, and writing."
hiillanchcha,adjective,skillful; handy%,"I hiillanchcha asa; aybanne 
koolanawu danddayees.",He is a handy person; He can fix anything.
hindda,interjection,let's go! (singular)%,"Sa'ay qammiis; hodde hindda\
hinddite!",It is getting dark; so let's go!
hinddiriitaa,noun,"spindle, spinning stick%",puuttuwa suqqiyo hinddiriitaa,a spindle for spinning cotton
hinggettaa,noun,hook (hook on stick)%,"Nena kushiyan gattana xayikko, 
loomiya hinggettan duutta.","Grab the oranges with the hook if you can't reach 
them by hand."
hinnintta,pronoun,those (accusative feminine plural)%2 . adjective%,,
hinnintta,pronoun,"those 
(accusative feminine plural)",,
hinnintti,pronoun,those (nominative feminine plural)%2 . adjective%,,
hinnintti,pronoun,"those 
(nominative feminine plural)",,
hiraagiyagaa,noun,"fortune teller, seer, predictor%","Hiraagiyagee hananabaa 
yootees.",A fortune teller predicts the future.
hirggaa,noun,anxiety; worry%,Hirggay asaa de'uwa qohees.,"Anxiety hurts 
the lives of people."
hirggissiya,adjective,intimidating; causing fear; scary; frightening%,"I 
hirggissiya metuwan geliis.",He encountered a scary problem.
hirggiya,adjective,anxious%,hirggiya asaa,anxious men
hirimaa,noun,"an accursed thing, a forbidden item that is taken before God%",,
hirimaa,noun,vow (unfulfilled)%(syn) [shiiquwa],,
hisaabiya,noun,math; mathematics%,"Hisaabee paydotu, coratettaanne qottaa 
xana'iyo timirttiya.","Mathematics is the study of numbers, quantities, and 
shapes."
uwa,noun,temperature; heat%,"Ho""oy likkettiyo miishshay termoomeetiriya
geetettees.",Temperatures are measured by an instrument called a thermometer.
hombbiya,noun,"heat, hot weather (warm enough to cause sweat)%","Hombbee eta 
azalssiis.",The hot weather made them lazy.
honqqooquwa,noun,"local medicine, seed of a plant used against tapeworm%",Honqqooqoy koosuwa geeshshees.,Local medicine cures from tapeworm.
hoogee,interjection,horror (expressing the feeling of horror)%,,
hoogee,interjection,"alas (shows
that one is suspicious or grieving)%(syn) [ayye]",,
hoommotiya,adjective,lathery%,hoommotiya saamunaa,"lathery soap
hooshettaa %1. noun%"
hoommotiya,adjective,"evaluation, inspection, check, provoke a reaction%(syn) 
[qaaserettuwa, dentterettuwa]%",,
hoommotiya,adjective,criticism,,
horppiina,adjective,soft; fragile; pliable; flexible%,,
horppiina,adjective,"cowardly; fearful; 
fretful; dreadful%(syn) [yuuqiyuuqa, yashshanchcha, hoppihoppa, horppa, 
tafitafa, hodhdhihodhdha]",,
hostteeliya,noun,"hostel, a place where people who work or study stay%",Oosanchcha maccaasatu hostteelee/aqiyosay aakimetun oyqettiis.,"The working 
women's hostel was occupied by nurses."
hudugaa,noun,chief; manager; principal; boss%,"Nu heeraa hudugay maganxxaa 
miidi qashettiis.",The chief of our village was imprisoned due to corruption.
humatettaa,noun,disability%,Humatettay hiyeesatetta gidenna.,"Disability 
is not poverty."
huqqunnaa,noun,"oppression%(syn) [naaquwa, nagaa]%",,
huqqunnaa,noun,chain (foot),,
gadaawaa,noun,manager; principal; boss; chief %,"Huuphe gadaaway ba 
kaalettiyo citaassi eta eraadan oosuwa gishiis.","The manager delegated the work
to all of the department teams according to their qualifications.
huuphe katamaa%1. noun%"
gadaawaa,noun,capital city%,Adisaabi Toophiyawu huuphe katama.,"Addis Ababa is the capital city of Ethiopia.
huuphiyan huuphiyan%1. adverb%"
gadaawaa,noun,everyone%,"Asay huuphiyan huuphiyan beeruwa 
yaanawu dees.",Everyone is going to come to the office.
huuphiyan,postposition,"on, on the top %","Geleshshoy mittaa huuphiyan 
uttiis.",The monkey sat on the top of the tree.
mokonniniya,noun,cadet%,"Iccu mokonneti wottadara yara gidanawu 
loohosona.","Cadets train to be members of the armed forces.
ichcha wobaxaa%1. noun%"
mokonniniya,noun,tax%,"Beni wode ichcha wobaxay kawuwa machcheessi 
giiriyo giiraa.",In olden days 'icha wobata' is a tax given to the queen.
ichchashutoo,adverb,five times%,"Nuuni saaminttan ichchashutoo tamaare soo 
boos.",We go to school five time a week.
iddiriya,noun,"union, mutual help union%",mooguwawu maaddiya iddiriya,"mutual aid union to help at burials
ifittaa golggiya%1. noun%"
iddiriya,noun,bolt%,Ifittay golggiyan gorddettees.,"We close the 
local door with a bolt."
ifittaa,noun,"door, local door (made of tendril)%","Qayxaariyappe giigiya 
gorddiya ifittaa geettees.",We call 'ifita' a local door made of tendril.
iirichchuwa,noun,"cotton blanket, a small cotton blanket%","A hiittan 
iirichchuwa maayaasu.",She wore the small cotton blanket in bed.
ililuwa,noun,honey%,Ililoy payyatettaassi lo''o.,"Honey is good for 
health."
imattaa,noun,guest; stranger%,A imattaassi mal''o qumaa kattada aattaasu.,She served delicious food for the guests.
imattatettaa,noun,"being a newcomer, being a guest%",,
imattatettaa,noun,"inexperience, newcomer,
feeling unfamiliar%(syn) [boorasiya, moozotettaa]",,
imatuwa,noun,hospitality; entertainment%,,
imatuwa,noun,"offering, crop offered to an idol
%(syn) [bassaa]
inchchirichchaa (inchchichiraa) %1. noun%",,
imatuwa,noun,leprosy%,"Inchchirichchay woriya 
saho.",Leprosy is a deadly disease.
indde,adjective,female (of animals)%,indde kuttiyo,a hen
inddiyo,noun,"hen, an adult female chicken%(syn) [kuttiyo]%",,
inddiyo,noun,"woman (of 
impolite)",,
inddustturiya,noun,industry%,Ne heeran ooratta inddusttiree keexettiis.,"The new industry was founded in your village.
inggaazettaa (inggaazuwa)%1. noun%"
inddustturiya,noun,moaning; groaning; grumbling%,"maahee 
haahuwan inggaazettaa",the tiger's grumbling in the distance
iqettaa,noun,hit hard%,,
iqettaa,noun,belly pain%,,
iqettaa,noun,squeeze,,
irkkabootiya,noun,saucer%,Siiniyanne irkkaabootiya meecca.,"Wash the cups
and saucers."
irppaniya,noun,"leather, the processed hide of animals without the fur or 
feathers removed%","Irppaniyan zin""iyogaa dosees.","He likes to sleep on the 
hides of cows."
