Word,Part of Speech,Meaning,Example (Wolaytta),Example (English)
aatuwa,noun,leak%,Kaaray aatuwa doommiis.,The roof began leakinig%
aatuwa,noun,serving(food or drink)%,,
aatuwa,noun,passing(exam or test)%,,
aatuwa,noun,insult%,"Haaasayaa aatoy 
laggetu giddon diya issippetetaa moorees.","An insult can break the tie between 
friends"
aatuwa,noun,leak%,Kaaray aatuwa doommiis.,The roof began leakinig%
aatuwa,noun,serving(food or drink)%,,
aatuwa,noun,passing(exam or test)%,,
aatuwa,noun,insult%,"Haaasayaa aatoy 
laggetu giddon diya issippetetaa moorees.","An insult can break the tie between 
friends
aayee aayyiyo%1. noun%"
aatuwa,noun,grandmother (maternal)%,"Nu aayee aayyiya nuussi 
miichchiya haysiya odaasu.",Our grandmother told us an amusing story.%
alamiya,noun,world; earth%,koyro alamiya olaa,the first world war%
alleequwa,noun,decoration; ornament; adornment; jewelry; jewel; luxury%,Almaazee alleeqo.,A diamond is a jewel.%
anjjuwa,noun,praise; blessing%,"Hayqquwa wodee gakkiyode aawati anjjuwa 
darotoo bantta naatussi aattoosona.","When the time of death comes, fathers 
usually pass on blessings to their children.%(syn) [ufaa]%"
anjjuwa,noun,extra; bonus%,"Maccaasiya maxiniya shammishin, bayzziyagee guutta anjjuwa immiis.","When the 
woman bought salt, the vender gave her a little extra.%(syn) [caraa , yessaa]"
anttettaa,noun,permission; consent; willingness%,"I timirttiya kaallanawu 
anttettaa demmiis.",He got permission to attend the class.%
anttettaa,noun,license%,"Taayyoo kaamiya laaggiyo anttettay baawa, shin ta kaamiya 
lagguwa danddayays.","Although I haven't a driver's license, I am able to drive 
a car."
araataa,noun,throne%,kawuwa araataa,the throne of a king%
araataa,noun,chair;,,
ashuwa,noun,meat; flesh%,"Nuuni maallado qan""iya issi kilo ashuwa xiixaa 
miida.",We ate half a kilo of roasted meat for breakfast.%
ashuwa,noun,relative%,"Ta ishaa
na'ay taayyoo asho.",My brother's son is my relative.
asttamaariya,noun,teacher; instructor; lecturer%,"Asttamaaree ba tamaareta 
shiishshi ekkiyagaa gidanawu koshshees.","A teacher has to be friendly to his 
students.%"
asttamaariya,noun,forgive; excuse%,Xoossay nu nagaraa atto giis.,God has forgiven our sins.%
asttamaariya,noun,how long%,A: Ne ay keena wodiya hagan takkadii?,"A: How 
long have you been here?%"
aymuwa,noun,dream; nightmare%,Niyo lo''o aymo gido!,Sweat dreams!%
aymuwa,noun,"wish, to wish to have%","Ta de'o layta aymoy
Asttamaarekiyanaassa.",My lifelong wish was to be a famous teacher.
uwa,noun,"backpack, an act of carrying on the back%","Qeeri naata zokkuwan
ba'iyogee daafurssiya ooso.","Carrying small children on the back is tiresome 
work.%"
uwa,noun,"burden, load (carried on the back)%","Ba'uwa wottada 
guuttaa shemppa ekka.",Put down the load and have a little rest.
baadiya,noun,soldier; army%,Baadee nu biittaa naagees.,"Soldiers guard 
our country.%"
baggaa,noun,supporter; comrade%,"Nuuni warettishin, ta laggee ta bagga.","When we were fighting, my friend was my supporter.%"
baggaa,noun,side; direction%,Yuniversttee hosppitaaliyappe haddirssa baggaara dees.,"The university is on 
the left side of the hospital.%○ Kaamee ogiyappe haddirssa baggaara laagettees.
%○ We drive cars on the left hand side of the road."
balaa,noun,"error; mistake; forgetfulness; misunderstanding; fault; defect; 
failure; shortcoming; guilt%",Eranchcha uray ba balaa ammanees.,"A wise person 
acknowledges his mistake.%"
bizza,adjective,"only child, a person who was born and brought up alone%",Ishi michcha yelettibeenna asi bizza geettees.,"An only child is a person who 
hasn't a sister or a brother.%"
bizza,adjective,outstanding%,"A 
asttamaariyassi bizza zaaruwa immaws.","She gives to the teacher outstanding 
answers."
borchchiborchcha,adjective,"rough, not smooth%","Borchchiborchcha ogee nu 
goommaa mooriis.",The rough road damaged our tires.%
care,adjective,marshy; soft; wet; muddy %,"Care biittan kaamiya 
laagganaagee meto.",It is difficult to drive on the marshy land. %
ciimma,adjective,deep %,Ciimma shaafay cora moliyara de'ees.,"The deep 
river contains a lot of fish. %"
ciimma,adjective,profound %,"Nuuni
gasttiyo wode nuuyyoo ciimma qofay de'ees.","As we mature, we have profound 
thoughts."
cora,adjective,"many, much, a lot of, a great deal of, numerous, plentiful,
abundant, innumerable, superabundant %","Gooba goshshanchchay shooqan cora qommo 
kattaa zerees.",A clever farmer sows a lot of grain in his farm. %
curqqaa,noun,rag %,Curqqay pooshettida ceega maayo.,"A rag is a piece of 
old cloth. %"
curqqaa,noun,old clothes %,"Ha curqqaa maayada asa sintti kiyanaw tana 
yeellayees.",I feel embarrassed wearing these old clothes in front of people.
dolliwaaqa,adjective,rude; obscene; oafish%,"Ne ha dolliwaaqa hanuwawu 
oyshettanawu daasa era.",You will be punished for this rude deed.%
doonaa,noun,mouth%,Doonaa hangga.,Open your mouth.%
doonaa,noun,language%,,
dumma,adjective,different; various; special; particular%,"Issi aayyiya 
yelido naa''u naatussi darotoo dumma meray de'ees.","Two children born from one 
mother often have different appearances.%"
dumma,adjective,deviant%,"A A geloosappe doommada dumma 
eeshshaa bessiyogaa doommaasu.","She started to show deviant behavior after she 
married him."
dure,adjective,rich; wealthy; prosperous; affluent%,Ubbabay diyo asi dure.,An affluent person is wealthy.%
eceriya,noun,rat %,Garawiya eceriya oykkaasu.,The cat caught the rat. %
eceriya,noun,score (points of a game) %,"Taani A 
karttaa kaassan oyddu eceriya mizaas.","I scored four points against him while 
playing card."
emeriya,noun,"back yard, rear %","Emeriya giyogee keettaappe guyen issi issi 
darkko kattati mokkiyosaa.","A back yard is an area behind a house in which some
vegetables are grown. %"
equwa,noun,"stand, an act of standing %","Issi yohuwa ammanidi ba equwa 
minttiyogee go''ees.",It is important to believe in things and take stand. %
equwa,noun,arousal; erectness %(syn) [xinddaa] %,,
equwa,noun,posture %,"Ne equwa giigissa. 
Geellatoppa.",Improve your posture. Don't slouch.
eranchcha,adjective,"knowledgeable; hearty; wise; intelligent; competent; 
fit; capable; literate;educated; outstanding; understanding %","Eranchcha uray ba
balaa ammanees.",A wise person acknowledges his mistake. %
gaachchaa,noun,"grind, an act of grinding%","Woxay badalaa gaachchaayyoo 
lo''o.",The mill is good for the maize grind.%
gaachchaa,noun,digestion%,"Kattay uluwan 
gaacettennan ixxiyo metoy hara sahuwayyoo malaata gidanaw danddayees.","Problems
with digestion can be an indicator of other medical problems.
gaddabbi oottiis%1. transitive verb%"
gaachchaa,noun,grab; snatch; seize; hold; capture; poach;,,
gassammaa,noun,"humus, mold, decay, rottenness, decomposition, the organic 
component of soil, formed by the decomposition of leaves and other plant 
material by microorganisms%",Gassammay biittaa araddissanaw lo''o.,"Humus is 
good for soil fertility.%"
geeshsha,adjective,pure; clean; neat%,"Hayyanaa, neeyyoo geeshsha haatti 
danddee?","Please, do you have pure water to drink?%(syn) [walalla, xillo, 
mulxxuxxa, hummunna, qalxxaxxa, wululla.]%"
geeshsha,adjective,holy; saint; devout%,"Woossa keettay
geeshsha soho.",A church is a holy place.%
geeshsha,adjective,"certain, without doubt",,
geniya,noun,enemy; adversary; foe; vandal%,"Tooraa kiittiyagee bari asata 
geniya teqqanaadan kiittiis.","The captain ordered his men to defend the enemy.
%"
geniya,noun,"malice; evil%
(syn) [iitaa, palaa.]%",,
geniya,noun,sabotage,,
gitatettaa,noun,"greatness (the state of being big, huge, respected etc.)%",,
gitatettaa,noun,"nobility, fame (the condition of being very well known)%","Kawo Xoonnaa 
gitatettay Toophphiyan ubbasan erettiis.","King Tona's fame spread far and wide 
in Ethiopia.%"
gitatettaa,noun,respect%,Deriyan sabetiyogaa mala gitatetti baawa.,"It is the 
greatest form of respect to be admired by people.%(syn) [bonchchuwa, saaphuwa, 
boossuwa]"
gooba,adjective,"clever; brave; adroit; smart; skillful; courageous; plucky;
valorous; audacious%",Gooba tamaaree paaciyan metoy baynnan aadhdhees.,"A 
clever student will pass the examination without any problem.%"
hanqquwa,noun,anger; rage; wrath; indignation; irritation%,"Alaafee 
naaqqido gishshawu, hanqquwan kumi uttiis.","He was filled with anger because 
his boss treated him badly.%"
harggiya,noun,"disease; sickness; illness; ache; writhe; fatigue; agony; 
sufferance; pain%",Eedisee xalee baynna hargge.,"AIDS is an incurable disease.
%"
hayttaa,noun,ear%,Nuuni nu hayttan siyoos.,We hear with our ears.%
hayttaa,noun,"leaf
%",Mittaa hayttay bone carkkoy carkkiyode qoqofettees.,"The leaves of trees 
scatter in summer when the wind blows hard."
heeraa,noun,village; vicinity; surroundings; neighborhood; locality;,,
issippetettaa,noun,unity; fellowship%,"Deriya issippetettay morkkiya olan 
xoonnees.",The unity of people will defeat an enemy in the battle.%
issippetettaa,noun,solidarity%,,
issippetettaa,noun,"cooperation
issitoo issitoo%1. adverb%",,
issippetettaa,noun,"sometimes, occasionally (rather than all the time)%",Taani issitoo issitoo sukkaaree baynna tukkiya uyays.,"I sometimes drink coffee
without sugar.%"
issippetettaa,noun,"bus station, bus stand%","Ta nena kaamiya qatuwan 
naagaas.",I waited for you at the bus station.%
kko,connctive,if%,Zaaruwa taani eriyakkonne paaccanawu tana oychchadasa.,You asked me if I knew the answer.%
kko,connctive,towards%,"Wombbaraa neekko 
shiishsha.",Pull the chair towards you.
koottaa,noun,beehive; hive%,Mattay koottan eessees.,"Bees make honey in a
beehive.%"
koottaa,noun,"barrel, big basket, big basket to store grain or other property%",Koottay kattaa qolanawu maaddees.,"A large bamboo barrel is used for storing 
grain.%"
koshshaa,noun,interest; need; want; necessity%,"Asa na'awu de'iya koshshawu
zawi baawa.",Human wants are unlimited.%
koshshaa,noun,"search%(syn) [qaagettaa, 
qaaqqaasettaa, baadettaa, tattaafuwa, qaaqqaasuwa]%",,
koshshaa,noun,"quest
kushiya kesuwa%1. noun%",,
koshshaa,noun,raise (hand)%,,
koshshaa,noun,paying credit%(syn) [kushiya zaaruwa]%,,
atettaa,noun,freedom; liberty; independence%,"Dimookiraasee de'iyo 
biittan ay asinne la'atettan haasayidi ba qofaa qonccissanawu koshshees.",Everybody should have freedom of speech in a democratic country.%
atettaa,noun,spread%,"Uunoy mishonne irxxa sohuwan keehi 
laa'ees.",Malaria spreads in wet and hot places.%
atettaa,noun,breed; reproduce%,Udunxxee oshan laa'ees.,Flies breed on dung.
laggiya,noun,friend; companion; peer; partner%,"Lagge giyogee issoy 
issuwara dosettiyagaa.",Friends are those who like each other.%
likke,adjective,correct; exact; right; fair; definite%,Hegee likke zaaro.,"That is the exact answer. %(syn) [xillo, nagari baynna, gamma, adda, suure]%"
likke,adjective,equal; alike%,"Ta aawaynne taanne geesaa likke; nu garssan qaammiyaynne 
adduqiyay ba.","My father and I are of equal height; neither of us is shorter or
taller than the other.%"
likke,adjective,"specific
loddaara (leddaara)%1. adverb%",,
likke,adjective,slowly; gradually; carefully%,"Kaamiya loddaara 
laagga, hayyanaa.","Drive the car slowly, please.%"
loosuwa,noun,"path, narrow road, secondary road%","shaafaassi miyiyara 
effiiya loosuwa",a path by the side of a river%
loosuwa,noun,method; way; procedure; etiquette%,"He gimbbiyara 
dom""ettida kaamiya kooliyo maaray mankkay ay hiillanchchawunne ixxiis.","There 
is no way for the mechanic to repair the car which crashed into the building.%"
loosuwa,noun,"discipline, controlled behavior%","Yoogata maaraa mankkaa tamaarissiyogee 
yelidaageetuppe naagettees.","Children are expected to learn discipline from 
their parents.%(syn) [shoraa, seeraa, kandduwa.]%"
loosuwa,noun,propriety; decency,,
maarotaa,noun,forgiveness; mercy%,Xoossaa maarotay nu bolla,"God's mercy 
upon us%"
maarotaa,noun,excuse%,Wogaa eriiddi kanttiya asawu maaroti baawa.,"One who 
knowingly breaks the law has no excuse.%"
maataa,noun,right%,Asa ubbaayyoo ba qaalaa dichchanawu maatay de'ees.,Every nationality has a right to develop its language.%
maataa,noun,authority; responsibility%,"Yelidaageetussi naata suure 
dichchanawu maatay de'ees.","Parents have a responsibility to bring their 
children up properly."
maayuwa,noun,clothes; garment%,Lo''iya maayuwa maayida na'iya oonee?,"Who
is the girl wearing the lovely clothes?%"
maayuwa,noun,sweet; delicious; tasty%,"Nuuni hachchi mal""o 
qumaa miida.",We ate sweet food today.%
maraa,noun,"calf, young of a cow%",Maray hayqqana hanees.,"The calf is 
about to die.%(syn) [galuwa.]%"
maraa,noun,son; child%,"Maraw, tana woosa keettaa efiya 
ogiya bessuuttee?","Son, would you show me the way to the church?%"
maraa,noun,"yam, white-
fleshed potato-like tuber whose soft root is edible
masttootiya (maskkootiya)%1. noun%",,
maraa,noun,window%,Masttootiya dooya; tana hombbees.,Open the window; I feel hot.%
maraa,noun,screen%,"Televizhzhiiniya masttootiya 
xeella.",Look at the television screen
mayne,adjective,"sterile, infertile, barren, not fertile to give birth %",Baquloy yelenna mayne mehe.,"A mule is a sterile animal that does not give 
birth.%"
meraa,noun,appearance; color%,Geeshsha maayoy meraa loyttees.,"Clean 
clothes give you a good appearance.%"
miizziyo,noun,cow%,Miizziya maaxxawus.,A cow gives us milk.%
miizziyo,noun,"know, know completely%","A paaciyan aadhdhanaagaa 
milxxi oottidi erees.","He knows completely that she will pass the exam.%(syn) 
[eriis, luxiis, tamaariis, meezetiis.]%"
miizziyo,noun,"shave, shave completely%","A na'aa 
huuphphiya milxxi oottidi meediis.","She shaved the boy's hair completely.%(syn)
[meediis.]"
miyyiya,noun,"side, parallel path, flank%",keettawu ushachcha miyyiya,"the 
right side of the house %(syn) [exaa, kaafiyagaa]%"
miyyiya,noun,"help; function; assistance; 
aid; usage; relative; supporter; flank; partner; use; benefit; advantage; merit
%",Nu heeraa asay darotoo miyyee baynna asaa maaddees.,"People in our village 
usually help a person who has no relative.%(syn) [maaduwa, amppettaa, kaafiya, 
morggiya ohettaa, zemppuwa, tuuqiya, techchaa]"
mooruwa,noun,"error; mistake; forgetfulness; misunderstanding; fault; 
defect; failure; shortcoming; guilt; damage%",Xaacee tana qachchiis; hegee bala.,The police arrested me; it was a mistake.%
nagaraa,noun,"sin; iniquity; transgression; wickedness; depravity; 
immorality; debauchery; evil; turpitude; sin%",Wuuqqiyogee nagara.,"Stealing is
a sin. %"
ooshshaa,noun,"quarrel; fight; conflict; fracas; argument; dispute; debate; 
skirmish; strife; affray; riot; disturbance; unrest; commotion; trouble%",Oosanchchatuuranne qaxaridaageetuura ooshshay de'ees.,"There is conflict 
between the workers and the employers.%"
paaciya,noun,examination; test%,"Ha paacee keehi lefa; tamaare naati 
ubbaykka tammaappe tammaa demmidosona giyogaa mala.","This test was very easy; 
almost all the students got ten out of ten.%"
paaciya,noun,temptation%,"Tana dabidaabbiya dooya dooya giya paaciya xoonana 
danddayabeykke.",I couldn't resist the temptation to open the letter.
panggaa,noun,"bandit; robber; gangster; burglar; pillager; mugger; culprit; 
vandal; gang; thief%",Panggay asa miishshaa woykko buquraa boggi ekkiyagaa.,"A 
robber is a person who snatches money or property.%"
peerettaa,noun,"tearing out, breaking (of a seal)%",,
peerettaa,noun,"hole; rip; opening; pore
%",A ba qamisiyan de'iya peerettaa sikkaasu.,"She sewed the hole in her dress.%
(syn) [xoo'iya, luhuwa, daassaa, puliya.]%"
peerettaa,noun,pride%,"A peeretta hanoy nuussi 
aybane gidenna.",His pride is not our business.
puuraa,noun,swelling%,"I xaliya ekkin, puuray wodhdhiis.","He took medicine
and the swelling reduced.%(syn) [kixaa, gilppiciicaa.]%"
puuraa,noun,disappointment%,"Ayyoo 
tanaara diya puuray miishsha gaaso.","His disappointment with me is due to a 
financial reason.%(syn) [yiilluwa, lancciya, hanqquwa.]
qan''iya%1. noun%"
puuraa,noun,"breakfast, breakfastvfood, meal eaten in the morning%","Taani 
maallado qan''iya mabeenna gishshawu,tana namisiis.","Because I didn't have my 
breakfast in the morning, I am hungry.%"
qashuwa,noun,bundle%,qasho maataa,a bundle of grass%(syn) [xephiya.]%
qashuwa,noun,prison; imprisonment%,I qashuwappe birshshettiis.,"He was released from 
prison.%"
qashuwa,noun,tying; fastening,,
santtimiya,noun,"cent, ten cent coin%",,
santtimiya,noun,ten-cent coin%,"Tammu santtimee issi 
bira.",Ten ten-cent coins is one birr.%
santtimiya,noun,money%,"I bankkiyan daro santtiya 
wottiis.","He deposited a lot of money.%(syn) [miishshaa, gumaa.]"
sarotaa,noun,greeting; salutation%,Sarotay Toophphiya wogatuppe issuwa.,Greeting is an important part of Ethiopian culture.%
sarotaa,noun,peace%,"Sarotay inttiyo 
gido.",Peace to you.%
shoohuwa,noun,sheath; scabbard; shell%,I bisaa shoohuwan yeggiis.,"He put
the sword back in its sheath.%"
shoohuwa,noun,foreskin%,Shoohoy shemppuwa xeeraa genttees.,The foreskin covers the end of the penis.
shugo,adjective,soft; fragile; pliable; flexible%,"A nuussi keehi shugo 
muuziya aattaasu; nu maanawu danddayibookko.","She served very soft bananas; we 
couldn't eat them.%(syn) [walli giya, shum''iina.]%"
shugo,adjective,weak; slow; lazy; inactive;,,
taagaa,pronoun,"mine, first person singular possessive pronoun%","Hagee 
keettay taagaa.",This house is mine.%
taarikiya,noun,"history, past events%",Toophiya Taarikiya,Ethiopian
tamaa,noun,fire%,I tama daafan hayqqiis.,He died by fire accident.%
tiriya,noun,liver%,Tiree ashodan meetettees.,Liver is eaten like meat.%
tiriya,noun,copper ring (worn on finger)%,"Maccaasiya ba biradhdhiyan tire migiduwa 
wottaasu.",The woman put a copper ring on her finger.%
tumaa,noun,truth; fact; reality%,Worddanchchay tumaa haasayenna.,"A liar 
does not speak truth.%"
uluwa,noun,stomach; abdomen; womb; belly%,"Uloy ba garssan maracciyanne 
hara bolla kifileta xaaxi waaxiya bolla kifile.","The abdomen is the part of the
body that contains the intestines and other organs.%"
uluwa,noun,food; meal%,"Ooso loytti oottena asay simmidi issitoo 
maana ulo xalaaleessi doosona.","People who do not work hard live only for their
next meal."
wayssiya,adjective,"naughty; troublesome; mischievous; disobedient; 
difficult; obscure; notorious; awkward; crooked; obstinate; mulish; stubborn%",Issitoo issitoo asttamaaree danddayaa xayidi wayssiya tamaare naata seerees.,"Sometimes, the teacher gets impatient with the naughty students and punishes 
them.%"
wayssiya,adjective,unclear; confusing;,,
wogetaa,noun,civilization%,beni wode Griike Asaa wogetaa,"the 
civilization of the early Greeks%(syn) [eratettaa.]%"
wogetaa,noun,wealth; estate; affluence;,,
wogga,adjective,big; great; huge; massive; large; tall; awesome; mammoth;,,
xaraphpheezaa,noun,table%,xaraphpheezaanne wombbarata,"a table and chairs
%"
xaraphpheezaa,noun,"board, board of elders, corporate headquarters (in Wolaita KHC)",,
xillo,adjective,clean; neat; pure%,xillo haattaa,"clean water%(syn) 
[geeshsha, walalla, mulxxuxxa, hummunna, qalxxaxxa, wululla.]%"
xillo,adjective,"righteous; 
absolute; just; faultless; blameless; right%","Entte soo aaway xillo asa; oonne A
nashshees.","Your father is a just man; everybody admires him.%(syn) [likke, 
nagari baynna, gamma, adda, suure.]"
xiskkuwa,noun,sleep; nap; doze; slumber%,"Neeni daafuriyo wode, niyo guutta
xiskkoy koshshees.","When you are exhausted, you need a little sleep.%"
xuntta,adjective,narrow; tight; thin; shrunken%,xuntta ogiya,"narrow road
%"
yafaraa,noun,furrow; row%,Qaacoy yafaran hemettees.,"Ants travel in a 
row.%"
yafaraa,noun,line%,I woraqatan sitta yafaraa xaafiis.,"He drew a straight line on a 
piece of paper.%"
yeluwa,noun,"giving birth, bringing life into being%","Na'iya koyro yeluwassi
bantta soo biyogee Wolaytta woga.","In Wolaita culture, a lady is taken to her 
parent's home to give birth to her first child.%"
yeluwa,noun,child%,Cora yeluwa dichchanaagee wayssees.,"It is 
difficult to raise many children.
yiggi xeelliis%1. transitive verb%"
yeluwa,noun,compare; balance; analyze%,"Ane ne 
oyssaappenne taagaappe awugee dariyakko yiggi xeellidi be'oos.","Let's compare 
your butter and mine and see which is greater.%(syn) [likkiis, kiliis, 
geeddarissiis, wadhdhiis1, yiggiis, xakkayiis.]%"
yeluwa,noun,evaluate; inspect; check%,Daannay markkaa qaalaa yiggi xeellibeenna.,"The judge has not evaluated the 
witness' testimony.%(syn) [hooshiis.]"
yiilluwa,noun,anger; wrath; indignation; annoyance; resentment; reproach;,,
zammaana,adjective,modern; up-todate%,"Ha wodiya naati zammana maayuwa 
maayanawu dosees.","These days, children like to wear modern clothes.%"
zammaana,adjective,"fashionable, currently popular%",zammaana maayuwa,fashionable clothes%
addiya,noun,"boy, male, male person%",Etaso aayyiya addiya yelaasu.,"Their 
mother gave birth to a boy%"
addiya,noun,cock%,Kutto addee maallado waassiis.,"The cock 
crowed in the morning.%"
addiya,noun,old man%,"Na'ay toochchidi bitaniya ""addiya"" giigi 
xeesiis.","The boy rudely called the main ""adiya."""
addiya,noun,"boy, male, male person%",Etaso aayyiya addiya yelaasu.,"Their 
mother gave birth to a boy%"
addiya,noun,cock%,Kutto addee maallado waassiis.,"The cock 
crowed in the morning.%"
addiya,noun,old man%,"Na'ay toochchidi bitaniya ""addiya"" giigi 
xeesiis.","The boy rudely called the main ""adiya."""
amaliya,noun,mood; violence; disobedience; opponent; rebellion%,"Amalee 
yiilluwa qonccisiyo hanqquwa.","Mood implies a feeling or display of sullen 
anger.%"
amaliya,noun,conduct; behavior; character%,"Geella naatuura pee'idi iita amaliya 
eriis.",He learned his bad behavior by being with bad children.%
amaliya,noun,habit;,,
ammanuwa,noun,belief; faith; conviction; reliance%,"Ta ammanoy daro 
tamaarida asawu daro qaaday diyogaa.","I have a belief that the more education 
one has the better opportunities one has.%"
ammanuwa,noun,religion%,Asay alamiyan cora ammanuwa kaallees.,"People follow many
religions in the world. %(syn) [haymaanootiya]"
ane,interjection,just%,Ane bu! Nena ta baqqa yeggana.,"Just dare to go! I
will slap you.%"
ane,interjection,let%,Asay kariya qoxxees. Ane gelona hayyanaa.,"Somebody is 
knocking. Please let them in.%"
ane,interjection,please,,
aysuwa,noun,governance; administration; management%,"Asay aysoy 
kaymatettaanne geeshshatettaa koyees yaagees.","People say that governance 
requires maturity and honesty.%"
aysuwa,noun,"marriage (widow's 
marriage)%",,
aysuwa,noun,passing night,,
azalla,adjective,weak; feeble; weary%,"Azalla haree konttaale maxiniya 
caanana danddayenna.","The feeble donkey cannot carry a quintal of salt.%(syn) 
[zililiina, tushula, gililiina]%"
azalla,adjective,lazy; slow (learner)%,"Timirttiya azalla 
tamaaree paaciyan aadhdhibeenna.","The lazy student has not passed the 
examination.%"
azazuwa,noun,order; command%,"Asi ubbi ba gadaawaa azazzuwa naggana 
bessees.",Everybody must follow the orders of his/her boss.%
azazuwa,noun,"instruction, 
statement of command%",,
azazuwa,noun,commandment%,tammu azazota,ten commandments%
azazuwa,noun,"will, 
legacy, bequest made in will%(syn) [bazettaa, hayqqiiddi immiyo qaalaa]",,
coo,adverb,in vain%2. pronoun%,,
coo,adverb,nothing%3. adverb%,,
coo,adverb,simple %,"Nuuni coo 
kattaa: daabuwara shayiyara kahuwa mi aqida.","We had a simple dinner of bread 
and tea. %4. adjective%"
coo,adverb,free,,
desha,adjective,naughty; troublesome; mischievous; disobedient%,"Desha 
na'ay bari asttamaareessi azazettenna.","The naughty child does not obey her 
teacher.%(syn) [undduwaalo, qaxiballo, wuttaalo, xaaxetta, qaxa, kinnaalo, 
dirqqalletta, wayssiya, geella, xambbixallo, xambbarsso, wulaato, shikkaalo, 
shikkibillo, xaaphaalo, doossa, muttaamuro.]%"
desha,adjective,difficult; obstinate; mulish;,,
eessaa,noun,"honey, nectar, a sweet sticky yellowish-brown fluid made by 
bees and other insects from flower nectar%",Eessay bariya adussees.,"Honey 
prolongs life. %"
eessaa,noun,mead %,Caalida eessaa uyiyogee mattoyees.,"Drinking 
fermented mead causes one to be drunk. %"
eessaa,noun,hydromel %,"Haattan maarido eessay 
Paranjjattuwan 'haydromeeliya' geetettees.","In English, honey mixed with water 
is called hydromel."
eqa,adjective,"abnormally tall, ill proportioned%","Eqa keettay maara 
keexettibeenna.",The ill-proportioned house was built incorrectly. %
eqa,adjective,"pointed 
(of nose) %",Assi siiree eqa.,He has a pointed nose. %
eqa,adjective,"nagging, complaining, 
terrible (of a man)%",eqa maccaaasiyo,a nagging wife
erettida,adjective,"well-known; prominent; popular; noticeable; famous; 
noted; acquaintance %",I erettida akttere.,He was a well-known actor. %
gadaawaa,noun,hunt leader%,,
gadaawaa,noun,"commander, general of army%",,
gadaawaa,noun,"chairman, kebele 
leader, officer, high mark%",A aaway gadaawavgididi dooretiis.,"His father was 
elected to the position of chairman.%"
gadaawaa,noun,boss; arbiter%,"Ta gadaaway ba beeruwa 
zino yeddiis.",My boss resigned his office yesterday.%(syn) [halaafiya.]
gadiya,noun,"plot, land, yard, a small piece of ground%","Aaway hayqqin naati
gadiya shakki ekkidosona.","The children divided the plot of land when their 
father died.%"
gadiya,noun,land%,"Gadee biittaa kifiliyappe haattan kamettibeenna minniya
sohuwa.","Land is the solid part of the earth’s surface not covered by a body of
water."
gakettaa,noun,coming; arrival; appearance%,"Toophiya bayra Wottay Hayle 
Gebre Sillaasee gakettaappe simmin doomettiis.","The Great Ethiopian Race began 
after Haile Gebre Selassie's arrival.%"
gakettaa,noun,"ripening, the process of ripening, or 
developing something (for example fruits, vegetables etc.)%","Ta ishay nu biittaa
zilaytti badala gakettan yiis.","My brother visited our family last year during 
the ripening of maize.%"
gakettaa,noun,maturation; growth%,yiiratu asa gamma gakkettaa,"the 
maturation of children
geela'iyo%1. noun%"
gakettaa,noun,girl%,"I bantta sooppe kalliidi diya keettaappe geela'iyo 
ekkiis.","He married the girl next door.%(syn) [galddiyo, mulssiyo.]%"
gakettaa,noun,virgin,,
